name,price,description,category,image_path
Practical Granite Table,408.0,Harum cupiditate temporibus quia quasi explicabo provident aut libero maiores.,"Health, Electronics & Shoes",media//perferendis.png
Practical Linen Pants,316.0,Quod expedita nihil quisquam rerum doloribus vel hic numquam ullam.,Games & Outdoors,media//quia.png
Fantastic Plastic Hat,387.0,Atque tempora alias consequatur voluptates aspernatur aut autem ipsam et.,Electronics & Movies,media//fugiat.png
Enormous Concrete Shoes,294.0,Ratione sint nobis eum in voluptatem sed ut ex quos.,Books,media//id.png
Intelligent Steel Coat,260.0,Et aut fugit sit ea sed ea impedit cum nam.,"Electronics, Shoes & Kids",media//voluptatem.png
Спеціальний товар,999,Це тестовий опис,Вітаміни,media/vitamins/special_item.png
